<!ELEMENT scoalaSoferi (studenti, instructori, informatie)>
<!ELEMENT studenti (student*)>
<!ELEMENT instructori (instructor*)>
<!ELEMENT student (nume, numarTelefon, sex, varsta, adresa, examen*, dataInscriere, categorie+)>
<!ELEMENT instructor (nume, numarTelefon, sex, varsta, adresa, masina, categorie+)>
<!ELEMENT informatie (nume, dataDeschidere)>
<!ELEMENT examen (dataExamen, nota)>
<!ELEMENT masina (model, anFabricatie, culoare, tip)>
<!ELEMENT dataInscriere (#PCDATA)>
<!ELEMENT dataDeschidere (#PCDATA)>
<!ELEMENT nume (#PCDATA)>
<!ELEMENT categorie (#PCDATA)>
<!ELEMENT numarTelefon (#PCDATA)>
<!ELEMENT sex (#PCDATA)>
<!ELEMENT adresa (#PCDATA)>
<!ELEMENT dataExamen (#PCDATA)>
<!ELEMENT nota (#PCDATA)>
<!ELEMENT model (#PCDATA)>
<!ELEMENT anFabricatie (#PCDATA)>
<!ELEMENT culoare (#PCDATA)>
<!ELEMENT tip (#PCDATA)>
<!ELEMENT varsta (#PCDATA)>
